<?xml version="1.0" encoding="utf-8"?>
<!-- Created with Liquid Technologies Online Tools 1.0 (https://www.liquid-technologies.com) -->
<xs:schema xmlns:xsi="http://www.w3.org/2001/XMLSchema-instance" attributeFormDefault="unqualified" elementFormDefault="qualified" xmlns:xs="http://www.w3.org/2001/XMLSchema">
  <xs:element name="store">
    <xs:complexType>
      <xs:sequence>
        <xs:element minOccurs="0" name="products">
          <xs:complexType>
            <xs:sequence>
              <xs:element minOccurs="0" maxOccurs="unbounded" name="product">
                <xs:complexType>
                  <xs:sequence>
                    <xs:element minOccurs="0" name="productName" type="xs:string" />
                    <xs:element minOccurs="0" name="price" type="xs:unsignedByte" />
                    <xs:element minOccurs="0" name="stockVolume" type="xs:unsignedShort" />
                  </xs:sequence>
                  <xs:attribute name="productid" type="xs:unsignedByte" use="optional" />
                </xs:complexType>
              </xs:element>
            </xs:sequence>
          </xs:complexType>
        </xs:element>
      </xs:sequence>
    </xs:complexType>
  </xs:element>
</xs:schema>